{
  "$schema": "https://json-schema.org/draft/2020-12/schema",
  "$id": "urn:foi-o:schema:bounded-pilot-execution-input-readiness:0.2.0",
  "$defs": {
    "sha": {"type": "string", "pattern": "^[a-f0-9]{64}$"},
    "pin": {"type": "object", "additionalProperties": false, "required": ["path", "sha256", "repository_commit"], "properties": {"path": {"type": "string", "minLength": 1}, "sha256": {"$ref": "#/$defs/sha"}, "repository_commit": {"type": "string", "pattern": "^[a-f0-9]{40}$"}}},
    "output": {"type": "object", "additionalProperties": false, "required": ["output_name", "source_sha256", "output_sha256", "byte_count"], "properties": {"output_name": {"type": "string", "pattern": "^attachment-00[0-2]\\.txt$"}, "source_sha256": {"$ref": "#/$defs/sha"}, "output_sha256": {"$ref": "#/$defs/sha"}, "byte_count": {"type": "integer", "minimum": 1}}}
  },
  "type": "object",
  "additionalProperties": false,
  "required": ["schema_version", "readiness_id", "status", "derived_from_readiness", "attachment_derivation_result", "base_semantics_unchanged", "sampling_scope", "claim_scope", "attachment_derivation_summary", "candidate_components_complete", "exact_readiness_approval_present", "inputs_ready", "derived_text_read_allowed", "context_materialization_allowed", "context_presentation_allowed", "analyst_execution_allowed", "reconciliation_allowed", "execution_allowed", "population_inference_allowed", "archive_wide_claim_allowed", "empirical_claims_allowed", "empirical_evidence", "human_reviewed", "gold_eligible", "legal_certified", "redistribution_allowed", "training_allowed", "fine_tuning_allowed", "publication_allowed", "release_allowed", "dataset_publication_allowed", "paper_updates_allowed", "local_only", "separate_context_and_execution_authorization_required", "clean_head_pre_execution_verification_required", "prohibited_actions"],
  "properties": {
    "schema_version": {"const": "foi-o.bounded-pilot-execution-input-readiness.v0.2.0"}, "readiness_id": {"const": "bounded-pilot-inputs-11872-35076-v0.2"}, "status": {"const": "candidate_components_complete_pending_exact_readiness_approval"},
    "derived_from_readiness": {"const": {"path": "examples/v2/bounded-pilot-execution-input-readiness.pending.json", "sha256": "2ff952599608ebf294af8a3b8a0043c07231dfccf31ccf675cf8608ef040a6b6", "repository_commit": "a51220986faaf8b33da37111cfa982b548ec708e"}}, "attachment_derivation_result": {"const": {"path": "examples/v2/bounded-pilot-attachment-mutool-derivation-result.1.json", "sha256": "271a15a0f93451be4db2d35be0721c16734d0e643d8d04a5dfb421fb1bd4eded", "repository_commit": "f5d59d22a77240db72884a2bedcffcbb731ea59d"}},
    "base_semantics_unchanged": {"const": true}, "sampling_scope": {"const": "purposive_two_case_local_pilot_requests_11872_and_35076_only"}, "claim_scope": {"const": "case_level_feasibility_only_no_population_or_archive_wide_inference"},
    "attachment_derivation_summary": {"type": "object", "additionalProperties": false, "required": ["request_id", "output_directory", "source_count", "output_count", "pass_count", "repeat_outputs_match", "nonempty_stderr_observed", "directory_mode", "file_mode", "manifest_sha256", "outputs", "restricted_outputs_committed", "content_embedded", "content_decoded_for_readiness", "content_presented", "future_integrity_recheck_requires_separate_authorization"], "properties": {"request_id": {"const": "11872"}, "output_directory": {"const": "/private/tmp/foio-bounded-pilot-11872-derived"}, "source_count": {"const": 3}, "output_count": {"const": 3}, "pass_count": {"const": 2}, "repeat_outputs_match": {"const": true}, "nonempty_stderr_observed": {"const": false}, "directory_mode": {"const": "0700"}, "file_mode": {"const": "0600"}, "manifest_sha256": {"const": "397ed6aca070c7c6bd4830ec590104257fef225d3206939a1da94fdeddc8e503"}, "outputs": {"const": [{"output_name": "attachment-000.txt", "source_sha256": "787ac62017c339e6fba9dba53ec699f143c9aea9554adc10cbdf686a90f4f4de", "output_sha256": "86c46ffefa2b7f0e0258f54c98b6ddc7507e300e0f07469c73468ab28434a04b", "byte_count": 3742}, {"output_name": "attachment-001.txt", "source_sha256": "30e63d1d5d65a416cee9aeb1d2734d1ee8a21da5594e308760e176d0b012c0e4", "output_sha256": "09c9e593eb1ff164c5783ac51db39cdd771f055650bdf68a76c51fb95aa0d313", "byte_count": 13256}, {"output_name": "attachment-002.txt", "source_sha256": "1d1c9eda958de560abea6285182ed6f4ae747944cabfc6bc7485f5707adec79d", "output_sha256": "f66a934f00ac9996c8cf24f0c778162e24b53dd4478c6104f47b6e53a45e349b", "byte_count": 177153}]}, "restricted_outputs_committed": {"const": false}, "content_embedded": {"const": false}, "content_decoded_for_readiness": {"const": false}, "content_presented": {"const": false}, "future_integrity_recheck_requires_separate_authorization": {"const": true}}},
    "candidate_components_complete": {"const": true}, "exact_readiness_approval_present": {"const": false}, "inputs_ready": {"const": false}, "derived_text_read_allowed": {"const": false}, "context_materialization_allowed": {"const": false}, "context_presentation_allowed": {"const": false}, "analyst_execution_allowed": {"const": false}, "reconciliation_allowed": {"const": false}, "execution_allowed": {"const": false}, "population_inference_allowed": {"const": false}, "archive_wide_claim_allowed": {"const": false}, "empirical_claims_allowed": {"const": false}, "empirical_evidence": {"const": false}, "human_reviewed": {"const": false}, "gold_eligible": {"const": false}, "legal_certified": {"const": false}, "redistribution_allowed": {"const": false}, "training_allowed": {"const": false}, "fine_tuning_allowed": {"const": false}, "publication_allowed": {"const": false}, "release_allowed": {"const": false}, "dataset_publication_allowed": {"const": false}, "paper_updates_allowed": {"const": false}, "local_only": {"const": true}, "separate_context_and_execution_authorization_required": {"const": true}, "clean_head_pre_execution_verification_required": {"const": true},
    "prohibited_actions": {"const": ["derived_text_read", "context_materialization", "context_presentation", "analyst_execution", "reconciliation", "empirical_result_approval", "population_inference", "archive_wide_claims", "human_reviewed_claims", "gold_promotion", "legal_certification", "redistribution", "publication", "training", "fine_tuning", "release", "dataset_publication", "paper_updates"]}
  }
}
