{
  "schema_version": "foi-o.bounded-pilot-execution-input-readiness.v0.2.0",
  "readiness_id": "bounded-pilot-inputs-11872-35076-v0.2",
  "status": "candidate_components_complete_pending_exact_readiness_approval",
  "derived_from_readiness": {"path": "examples/v2/bounded-pilot-execution-input-readiness.pending.json", "sha256": "2ff952599608ebf294af8a3b8a0043c07231dfccf31ccf675cf8608ef040a6b6", "repository_commit": "a51220986faaf8b33da37111cfa982b548ec708e"},
  "attachment_derivation_result": {"path": "examples/v2/bounded-pilot-attachment-mutool-derivation-result.1.json", "sha256": "271a15a0f93451be4db2d35be0721c16734d0e643d8d04a5dfb421fb1bd4eded", "repository_commit": "f5d59d22a77240db72884a2bedcffcbb731ea59d"},
  "base_semantics_unchanged": true,
  "sampling_scope": "purposive_two_case_local_pilot_requests_11872_and_35076_only",
  "claim_scope": "case_level_feasibility_only_no_population_or_archive_wide_inference",
  "attachment_derivation_summary": {
    "request_id": "11872",
    "output_directory": "/private/tmp/foio-bounded-pilot-11872-derived",
    "source_count": 3,
    "output_count": 3,
    "pass_count": 2,
    "repeat_outputs_match": true,
    "nonempty_stderr_observed": false,
    "directory_mode": "0700",
    "file_mode": "0600",
    "manifest_sha256": "397ed6aca070c7c6bd4830ec590104257fef225d3206939a1da94fdeddc8e503",
    "outputs": [
      {"output_name": "attachment-000.txt", "source_sha256": "787ac62017c339e6fba9dba53ec699f143c9aea9554adc10cbdf686a90f4f4de", "output_sha256": "86c46ffefa2b7f0e0258f54c98b6ddc7507e300e0f07469c73468ab28434a04b", "byte_count": 3742},
      {"output_name": "attachment-001.txt", "source_sha256": "30e63d1d5d65a416cee9aeb1d2734d1ee8a21da5594e308760e176d0b012c0e4", "output_sha256": "09c9e593eb1ff164c5783ac51db39cdd771f055650bdf68a76c51fb95aa0d313", "byte_count": 13256},
      {"output_name": "attachment-002.txt", "source_sha256": "1d1c9eda958de560abea6285182ed6f4ae747944cabfc6bc7485f5707adec79d", "output_sha256": "f66a934f00ac9996c8cf24f0c778162e24b53dd4478c6104f47b6e53a45e349b", "byte_count": 177153}
    ],
    "restricted_outputs_committed": false,
    "content_embedded": false,
    "content_decoded_for_readiness": false,
    "content_presented": false,
    "future_integrity_recheck_requires_separate_authorization": true
  },
  "candidate_components_complete": true,
  "exact_readiness_approval_present": false,
  "inputs_ready": false,
  "derived_text_read_allowed": false,
  "context_materialization_allowed": false,
  "context_presentation_allowed": false,
  "analyst_execution_allowed": false,
  "reconciliation_allowed": false,
  "execution_allowed": false,
  "population_inference_allowed": false,
  "archive_wide_claim_allowed": false,
  "empirical_claims_allowed": false,
  "empirical_evidence": false,
  "human_reviewed": false,
  "gold_eligible": false,
  "legal_certified": false,
  "redistribution_allowed": false,
  "training_allowed": false,
  "fine_tuning_allowed": false,
  "publication_allowed": false,
  "release_allowed": false,
  "dataset_publication_allowed": false,
  "paper_updates_allowed": false,
  "local_only": true,
  "separate_context_and_execution_authorization_required": true,
  "clean_head_pre_execution_verification_required": true,
  "prohibited_actions": ["derived_text_read", "context_materialization", "context_presentation", "analyst_execution", "reconciliation", "empirical_result_approval", "population_inference", "archive_wide_claims", "human_reviewed_claims", "gold_promotion", "legal_certification", "redistribution", "publication", "training", "fine_tuning", "release", "dataset_publication", "paper_updates"]
}
